{
  "breslow_qualifier": "rmm2",
  "breslow_thickness_mm": 6,
  "diagnosis": "invasive melanoma, superficial spreading melanoma",
  "document_id": "MEL-003-A",
  "laterality": "midline",
  "margins": {
    "in_situ_deep": "not_involved",
    "in_situ_peripheral": "not_involved",
    "invasive_deep": "not_involved",
    "invasive_peripheral": "not_involved"
  },
  "mitotic_qualifier": null,
  "mitotic_rate_per_mm2": null,
  "specimen_site": "posterior scalp",
  "staging": {
    "pM": null,
    "pN": "pn not assigned",
    "pT": "pt3b",
    "stage_group": null
  },
  "ulceration": "not_identified"
}
