{
  "breslow_qualifier": "at_least",
  "breslow_thickness_mm": "0.3",
  "diagnosis": "invasive melanoma, superficial spreading melanoma",
  "document_id": "MEL-005-B",
  "laterality": "midline",
  "margins": {
    "in_situ_deep": null,
    "in_situ_peripheral": null,
    "invasive_deep": "not_involved",
    "invasive_peripheral": "not_involved"
  },
  "mitotic_qualifier": null,
  "mitotic_rate_per_mm2": null,
  "specimen_site": "midline central chest",
  "staging": {
    "pM": null,
    "pN": null,
    "pT": "pt1a",
    "stage_group": null
  },
  "ulceration": "not_identified"
}
