{
  "breslow_qualifier": null,
  "breslow_thickness_mm": 2.4,
  "diagnosis": "invasive melanoma, superficial spreading melanoma",
  "document_id": "MEL-003-A",
  "laterality": null,
  "margins": {
    "in_situ_deep": "not involved",
    "in_situ_peripheral": "not involved",
    "invasive_deep": "not involved",
    "invasive_peripheral": "not involved"
  },
  "mitotic_qualifier": null,
  "mitotic_rate_per_mm2": 6,
  "specimen_site": "midline posterior scalp",
  "staging": {
    "pM": null,
    "pN": "pn not assigned",
    "pT": "pt3b",
    "stage_group": null
  },
  "ulceration": "present"
}
