{
  "breslow_qualifier": "at_least",
  "breslow_thickness_mm": 1.0,
  "diagnosis": "Invasive melanoma, superficial spreading melanoma",
  "document_id": "MEL-006-A",
  "laterality": "left",
  "margins": {
    "in_situ_deep": "not_involved",
    "in_situ_peripheral": "not_involved",
    "invasive_deep": "not_involved",
    "invasive_peripheral": "not_involved"
  },
  "mitotic_qualifier": "exact",
  "mitotic_rate_per_mm2": 2,
  "specimen_site": "left thigh",
  "staging": {
    "pM": null,
    "pN": "pno",
    "pT": "pt1b",
    "stage_group": "Stage IA"
  },
  "ulceration": "not_identified"
}
