{
  "breslow_qualifier": null,
  "breslow_thickness_mm": 1.0,
  "diagnosis": "invasive melanoma",
  "document_id": "MEL-006-B",
  "laterality": "left",
  "margins": {
    "in_situ_deep": "not involved",
    "in_situ_peripheral": "not involved",
    "invasive_deep": "not involved",
    "invasive_peripheral": "not involved"
  },
  "mitotic_qualifier": null,
  "mitotic_rate_per_mm2": null,
  "specimen_site": "left thigh",
  "staging": {
    "pM": null,
    "pN": "pn0",
    "pT": "pt1b",
    "stage_group": "Stage IA"
  },
  "ulceration": "not identified"
}
