{
  "breslow_qualifier": "at_least",
  "breslow_thickness_mm": "2.0",
  "diagnosis": "invasive melanoma, nodular melanoma",
  "document_id": "MEL-007-A",
  "laterality": "null",
  "margins": {
    "in_situ_deep": "null",
    "in_situ_peripheral": "null",
    "invasive_deep": "involved",
    "invasive_peripheral": "involved"
  },
  "mitotic_qualifier": "at_least",
  "mitotic_rate_per_mm2": "4",
  "specimen_site": "posterior trunk",
  "staging": {
    "pM": "null",
    "pN": "null",
    "pT": "pT2",
    "stage_group": "null"
  },
  "ulceration": "null"
}
