{
  "breslow_qualifier": null,
  "breslow_thickness_mm": null,
  "diagnosis": "melanoma in situ, lentigo maligna type",
  "document_id": "MEL-004-B",
  "laterality": "right",
  "margins": {
    "in_situ_deep": null,
    "in_situ_peripheral": null,
    "invasive_deep": "not involved",
    "invasive_peripheral": "involved"
  },
  "mitotic_qualifier": null,
  "mitotic_rate_per_mm2": null,
  "specimen_site": "right shoulder",
  "staging": {
    "pM": null,
    "pN": null,
    "pT": "pT1s",
    "stage_group": null
  },
  "ulceration": null
}
